[
  {"id": "notif-001", "type": "alert", "severity": "critical", "title": "IPS breach detected: Equity allocation exceeded 70%", "body": "Portfolio ABC has exceeded maximum equity allocation constraint.", "link": "/m/ips/item/breach-001", "moduleKey": "ips", "recordId": "breach-001", "status": "unread", "userId": "usr-001", "createdAt": "2025-01-20T09:15:00Z"},
  {"id": "notif-002", "type": "task", "severity": "warning", "title": "Task overdue: Q4 Performance Report", "body": "The quarterly performance report is 2 days overdue.", "link": "/m/workflow/item/task-045", "moduleKey": "workflow", "recordId": "task-045", "status": "unread", "userId": "usr-001", "createdAt": "2025-01-20T08:00:00Z"},
  {"id": "notif-003", "type": "message", "severity": "info", "title": "New message from client: Johnson Family", "body": "Regarding: Tax planning for 2025", "link": "/m/comms/thread/thr-012", "moduleKey": "comms", "recordId": "thr-012", "status": "unread", "userId": "usr-004", "createdAt": "2025-01-19T16:30:00Z"},
  {"id": "notif-004", "type": "approval", "severity": "warning", "title": "Invoice pending approval: INV-2025-001", "body": "Q4 management fee invoice requires CFO approval.", "link": "/m/fees/item/inv-001", "moduleKey": "fees", "recordId": "inv-001", "status": "unread", "userId": "usr-003", "createdAt": "2025-01-19T14:00:00Z"},
  {"id": "notif-005", "type": "sync", "severity": "warning", "title": "Sync warning: Schwab connection", "body": "Authentication will expire in 7 days.", "link": "/m/integrations/item/conn-003", "moduleKey": "integrations", "recordId": "conn-003", "status": "unread", "userId": "usr-006", "createdAt": "2025-01-19T10:00:00Z"},
  {"id": "notif-006", "type": "system", "severity": "info", "title": "Monthly report package generated", "body": "December 2024 reports are ready for review.", "link": "/m/reporting/list", "moduleKey": "reporting", "recordId": null, "status": "read", "userId": "usr-001", "createdAt": "2025-01-18T09:00:00Z"},
  {"id": "notif-007", "type": "alert", "severity": "warning", "title": "Liquidity alert: Cash reserve below threshold", "body": "Smith Family cash reserves are below 10% of total assets.", "link": "/m/liquidity/item/alert-005", "moduleKey": "liquidity", "recordId": "alert-005", "status": "read", "userId": "usr-003", "createdAt": "2025-01-18T08:30:00Z"},
  {"id": "notif-008", "type": "task", "severity": "info", "title": "Task completed: Annual compliance review", "body": "The annual compliance review has been marked as complete.", "link": "/m/workflow/item/task-038", "moduleKey": "workflow", "recordId": "task-038", "status": "read", "userId": "usr-005", "createdAt": "2025-01-17T17:00:00Z"},
  {"id": "notif-009", "type": "approval", "severity": "success", "title": "Waiver approved: Real estate allocation", "body": "Investment committee approved temporary waiver.", "link": "/m/ips/item/waiver-003", "moduleKey": "ips", "recordId": "waiver-003", "status": "read", "userId": "usr-002", "createdAt": "2025-01-17T15:00:00Z"},
  {"id": "notif-010", "type": "message", "severity": "info", "title": "Thread closed: Document request", "body": "Wilson Trust document request has been resolved.", "link": "/m/comms/thread/thr-008", "moduleKey": "comms", "recordId": "thr-008", "status": "read", "userId": "usr-004", "createdAt": "2025-01-17T11:00:00Z"},
  {"id": "notif-011", "type": "sync", "severity": "success", "title": "Sync completed: All custodians", "body": "Daily sync completed successfully for all connections.", "link": "/m/integrations/list", "moduleKey": "integrations", "recordId": null, "status": "read", "userId": "usr-006", "createdAt": "2025-01-17T07:00:00Z"},
  {"id": "notif-012", "type": "alert", "severity": "critical", "title": "Suspicious login detected", "body": "Login from new location: Singapore", "link": "/m/security/item/inc-015", "moduleKey": "security", "recordId": "inc-015", "status": "unread", "userId": "usr-016", "createdAt": "2025-01-16T23:45:00Z"},
  {"id": "notif-013", "type": "task", "severity": "info", "title": "New task assigned: Trust distribution review", "body": "Review Q1 distribution schedule for Williams Trust.", "link": "/m/workflow/item/task-052", "moduleKey": "workflow", "recordId": "task-052", "status": "unread", "userId": "usr-007", "createdAt": "2025-01-16T14:00:00Z"},
  {"id": "notif-014", "type": "system", "severity": "info", "title": "Access review due in 14 days", "body": "Quarterly access review is scheduled for February 1st.", "link": "/m/security/list?tab=reviews", "moduleKey": "security", "recordId": null, "status": "read", "userId": "usr-016", "createdAt": "2025-01-16T09:00:00Z"},
  {"id": "notif-015", "type": "approval", "severity": "warning", "title": "Onboarding case pending: Chen Family", "body": "KYC documentation requires compliance review.", "link": "/m/onboarding/item/case-008", "moduleKey": "onboarding", "recordId": "case-008", "status": "unread", "userId": "usr-005", "createdAt": "2025-01-15T16:00:00Z"},
  {"id": "notif-016", "type": "alert", "severity": "warning", "title": "Tax deadline approaching: K-1 distribution", "body": "K-1 forms due in 30 days for 5 partnerships.", "link": "/m/tax/list?tab=deadlines", "moduleKey": "tax", "recordId": null, "status": "read", "userId": "usr-007", "createdAt": "2025-01-15T10:00:00Z"},
  {"id": "notif-017", "type": "message", "severity": "info", "title": "New message from advisor: James Mitchell", "body": "Regarding: Portfolio rebalancing recommendation", "link": "/m/comms/thread/thr-015", "moduleKey": "comms", "recordId": "thr-015", "status": "unread", "userId": "usr-002", "createdAt": "2025-01-15T09:30:00Z"},
  {"id": "notif-018", "type": "sync", "severity": "critical", "title": "Sync failed: Fidelity connection", "body": "Authentication error. Please re-authenticate.", "link": "/m/integrations/item/conn-001", "moduleKey": "integrations", "recordId": "conn-001", "status": "unread", "userId": "usr-006", "createdAt": "2025-01-14T07:15:00Z"},
  {"id": "notif-019", "type": "task", "severity": "warning", "title": "Task escalated: Reconciliation break", "body": "Unresolved break for account 12345 requires attention.", "link": "/m/reconciliation/item/break-003", "moduleKey": "reconciliation", "recordId": "break-003", "status": "read", "userId": "usr-006", "createdAt": "2025-01-14T11:00:00Z"},
  {"id": "notif-020", "type": "approval", "severity": "info", "title": "Document shared: Quarterly Statement", "body": "Johnson Family Q4 statement shared via secure link.", "link": "/m/documents/item/doc-089", "moduleKey": "documents", "recordId": "doc-089", "status": "read", "userId": "usr-004", "createdAt": "2025-01-13T16:00:00Z"},
  {"id": "notif-021", "type": "system", "severity": "success", "title": "Demo data initialized", "body": "Demo environment has been set up successfully.", "link": "/m/platform", "moduleKey": "platform", "recordId": null, "status": "read", "userId": "usr-001", "createdAt": "2025-01-01T00:00:00Z"},
  {"id": "notif-022", "type": "alert", "severity": "warning", "title": "Performance deviation: Growth Portfolio", "body": "Portfolio underperforming benchmark by 2.5%.", "link": "/m/performance/item/pf-003", "moduleKey": "performance", "recordId": "pf-003", "status": "read", "userId": "usr-002", "createdAt": "2025-01-12T10:00:00Z"},
  {"id": "notif-023", "type": "task", "severity": "info", "title": "Task reminder: Insurance policy renewal", "body": "Life insurance policy expires in 45 days.", "link": "/m/workflow/item/task-060", "moduleKey": "workflow", "recordId": "task-060", "status": "read", "userId": "usr-004", "createdAt": "2025-01-11T09:00:00Z"},
  {"id": "notif-024", "type": "message", "severity": "info", "title": "Thread update: Investment committee minutes", "body": "Minutes from January meeting have been posted.", "link": "/m/comms/thread/thr-020", "moduleKey": "comms", "recordId": "thr-020", "status": "read", "userId": "usr-001", "createdAt": "2025-01-10T14:00:00Z"}
]
